{"artifact_id":"artifact:blake3:aaaaaaaaaaaaaaaaaaaaaaaaaaaaaaaaaaaaaaaaaaaaaaaaaaaaaaaaaaaaaaaa","as_of":"2024-09-30T00:00:00Z","byte_hash":"blake3:bbbbbbbbbbbbbbbbbbbbbbbbbbbbbbbbbbbbbbbbbbbbbbbbbbbbbbbbbbbbbbbb","derived_from":[],"kind":"warehouse_read","media_type":"application/json","observed_at":"2026-09-15T00:00:00Z","payload_ref":"cas:blake3:bbbbbbbbbbbbbbbbbbbbbbbbbbbbbbbbbbbbbbbbbbbbbbbbbbbbbbbbbbbbbbbb","schema":"artifact.v0","scope_ref":"blake3:dddddddddddddddddddddddddddddddddddddddddddddddddddddddddddddddd","sensitivity":"public"}
